Document,router_label,reason,word_count,char_count,sentence_count,avg_word_length,language,readability,vocabulary_richness,special_char_ratio,number_ratio,punctuation_density,capital_ratio,has_email,has_phone,proper_noun_ratio,tfidf_confidence,tfidf_prediction,tfidf_success,tfidf_latency,transformer_confidence,transformer_prediction,transformer_success,transformer_latency
new headset friday pm headset hi headset regards,1,Low TF-IDF confidence (0.36); Rich vocabulary (0.75),8,48,1,6.0,en,50.66500000000002,0.75,0.0,0.0,0.0,0.0,0,0,0.0,0.35609059904256446,HR Support,True,0.007973,0.9743477702140808,HR Support,True,0.032834
pricing project list for bod delivery team members thursday july pricing members dear please create benefit pricing located pricing pricing further by add members future thanks head out july public holiday,1,Complex text (readability: 22.5); Rich vocabulary (0.77),31,205,1,6.612903225806452,en,22.544193548387113,0.7741935483870968,0.0,0.0,0.0,0.0,0,0,0.0,0.9115931043009704,Miscellaneous,True,0.007821,0.9957035183906555,Miscellaneous,True,0.050777
request wednesday pm number hello please number role contacted communicate directly phone thank planned absence ext,1,Rich vocabulary (0.94),16,115,1,7.1875,en,31.97,0.9375,0.0,0.0,0.0,0.0,0,0,0.0,0.7663499223565482,Hardware,True,0.007974,0.9907201528549194,Hardware,True,0.050653
not working on en re incident assistance resolved assigned hello issue was resolved his laptop en but needs simultaneous access also his desktop en problem can log into his desktop machine attached we manually downloaded application because part existing professional bit installation can you advise what thank you engineer ext en,1,Complex text (readability: -0.9); Rich vocabulary (0.82),51,330,1,6.470588235294118,en,-0.8594117647058397,0.8235294117647058,0.0,0.0,0.0,0.0,0,0,0.0,0.9436902441604047,Hardware,True,0.007983,0.979027271270752,Hardware,True,0.058808
site permissions hello please informed granted these sites find under more assistance feel free best regards engineer tuesday october re tickets site hi guys please thank best date tuesday october re tickets site hi guys haven heard regarding please help thanks friday october re tickets site hi please owner rights sites moment cannot also reason cannot find hub by client under while under client thanks friday october re tickets site hello want inform created spaces which accessed these links more assistance feel free best regards engineer thursday october pm tickets site dear please advised tickets logged assigned queue site client level site level thank much regards analyst ext hub thursday october site dear please create sites client level level both client active old thanks officer,1,Low TF-IDF confidence (0.65); Long text (125 words); Complex text (readability: -56.1),125,795,1,6.36,en,-56.07679999999998,0.512,0.0,0.0,0.0,0.0,0,0,0.0,0.6451252956165018,Miscellaneous,True,0.008226,0.984563946723938,Miscellaneous,True,0.112467
license needed for davies thursday july pm license needed hello please provide subscription architect stream his credentials thank senior tester ext,1,Complex text (readability: 28.4); Rich vocabulary (0.90),21,148,1,7.0476190476190474,en,28.40571428571431,0.9047619047619048,0.0,0.0,0.0,0.0,0,0,0.0,0.9503116617963052,Access,True,0.008111,0.9984696507453918,Access,True,0.051375
non starter for march pm re starter ad hi thank much creation ad unfortunately join please cancel apologies inconvenience,1,Rich vocabulary (0.89),19,121,1,6.368421052631579,en,31.70789473684212,0.8947368421052632,0.0,0.0,0.0,0.0,0,0,0.0,0.9181099142622028,HR Support,True,0.007627,0.9978027939796448,HR Support,True,0.035753
submission problems submission hello had two leave days october back today tried log days got error informing days interval must bigger than today input october leave thank,1,Rich vocabulary (0.78),27,172,1,6.37037037037037,en,35.29666666666668,0.7777777777777778,0.0,0.0,0.0,0.0,0,0,0.0,0.9613684496683058,HR Support,True,0.008044,0.9987829327583313,HR Support,True,0.044326
adaptor pm adaptor si adaptor,1,Unsupported language (id); Complex text (readability: -1.3),5,29,1,5.8,id,-1.2799999999999727,0.6,0.0,0.0,0.0,0.0,0,0,0.0,0.9644999588739921,Hardware,True,0.007787,0.9973849654197693,Hardware,True,0.025387
invoicing request invoicing hi please thank kind regards thursday re invoicing hi per kindly ask create attached code possible apologies rush best invoice closing thank much officer re invoicing hi form attached filled submitted please mention urgent code opened per earliest convenience thanks accounts receivable lead thursday re invoicing thanks everyone please ask create code issuing attached invoice terms take hit benefit client code best regards re invoicing has probably cost more than re invoicing everything lesson learned upcoming thanks thursday re invoicing good morning after checking reverting feedback over client invoiced codes opened having structure client invoiced hence has recognized under wont clear invoice procedure code reverse recognition recognized under additional needed please let thanks accounts receivable lead pm invoicing hi please invoice per excel draft attached left contracts attached details create client please note recognized under code entity although invoice different client entity clear mentioned thank help officer re hi good proceed thanks accounts receivable lead pm re hi regarding attached recognized client invoiced per contracts attached work done by relates golf event concerns recognizing invoicing thank officer re hi invoice signed contract countersign thanks hi understand invoice bit recognized think good out thanks tuesday pm re hi please find attached signed versions framework agreement work package once signed please back thanks partnerships strategy activation oxford street re hi reviewed attached final versions ready sign then back countersign final approved figures over thanks re hi well wondering had update stats receive confirmation amended thanks partnerships strategy activation oxford street morning please find attached work package framework agreement approved by re please sign clean copy return back then sign well copy yourselves hopefully then invoice note receive stats kind regards preceding attachments contains information confidential protected by attorney client other applicable privileges constitute public information intended conveyed designated recipient named intended recipient please notify by replying then delete copies computer dissemination reproduction by unintended authorized unlawful preceding attachments contains information confidential protected by attorney client other applicable privileges constitute public information intended conveyed designated recipient named intended recipient please notify by replying then delete copies computer dissemination reproduction by unintended authorized unlawful,1,Long text (353 words); Complex text (readability: -319.5),353,2612,1,7.399433427762039,en,-319.46169971671384,0.45892351274787535,0.0,0.0,0.0,0.0,0,0,0.0,0.7719130478550653,Internal Project,True,0.008228,0.7572327852249146,Internal Project,True,0.219491
remotely access on songs project thursday july pm remotely songs hello music songs want work remotely resources deploys saturdays needed remotely thank,1,Low TF-IDF confidence (0.64); Complex text (readability: 19.2); Rich vocabulary (0.77); Transformer more confident (0.99 vs 0.64),22,151,1,6.863636363636363,en,19.15045454545455,0.7727272727272727,0.0,0.0,0.0,0.0,0,0,0.0,0.6359956565641911,HR Support,True,0.008399,0.9949000477790833,Hardware,True,0.042905
unlock its account unlock hi can you unlock cannot anymore into best regards,1,Rich vocabulary (0.85),13,76,1,5.846153846153846,en,50.470769230769264,0.8461538461538461,0.0,0.0,0.0,0.0,0,0,0.0,0.9590070775267572,Access,True,0.007545,0.9979755282402039,Access,True,0.030992
new starter december starter form hello please help by filling out starter form thank ext,1,Rich vocabulary (0.80),15,89,1,5.933333333333334,en,67.53000000000003,0.8,0.0,0.0,0.0,0.0,0,0,0.0,0.9871206124955438,HR Support,True,0.007744,0.9987824559211731,HR Support,True,0.033742
implement rule to friday add additional rules hosted platform leeds importance high hi please implement attached rule thank kind regards discipline lead change coster add additional rules hosted platform leeds importance high hi changes per per attached rule detail document were implemented morning during window friday please test advise outcome thanks dedicated change mobile registered files attached confidential also legally privileged protected disclosure protected by other rules intended individual entity named named addressee received error please inform immediately delete copy disclose contents purpose thank please also note transmission cannot secure error free,1,Complex text (readability: -51.1); Rich vocabulary (0.72),92,676,1,7.3478260869565215,en,-51.147173913043446,0.717391304347826,0.0,0.0,0.0,0.0,0,0,0.0,0.8217838820846269,Hardware,True,0.008174,0.8187742829322815,Hardware,True,0.062519
intermittent laptop screen failure system intermittent laptop screen failure hi could you please log ticket investigate screen problem with machine en attached ll be monday th thanks allot infrastructure,1,Complex text (readability: 22.8); Rich vocabulary (0.83),29,203,1,7.0,en,22.786206896551732,0.8275862068965517,0.0,0.0,0.0,0.0,0,0,0.0,0.9786860531189182,Hardware,True,0.007807,0.9970621466636658,Hardware,True,0.057241
new purchase po thursday pm purchase po dear purchased please log installation please take consideration mandatory receipts section order receive item ordered kind regards administrator,1,Complex text (readability: 8.9); Rich vocabulary (0.88),25,185,1,7.4,en,8.876000000000005,0.88,0.0,0.0,0.0,0.0,0,0,0.0,0.9882716683533953,Purchase,True,0.007502,0.9985320568084717,Purchase,True,0.040184
block mails re re hi thanks letting about delete please add br blacklist regards pm re hi want report attached scam thank test consultant wrote deal has checked viruses by avast software se livre,1,Rich vocabulary (0.91),34,195,1,5.735294117647059,en,52.889705882352956,0.9117647058823529,0.0,0.0,0.0,0.0,0,0,0.0,0.7597653950939166,Hardware,True,0.008173,0.9698178172111511,Hardware,True,0.04997
critical alert sent october critical alert following alert occurred status active tape library based tape protection weeks copy description detailed tape inventory failed operation failed since slot library based was empty tape currently present drive drive,1,Low TF-IDF confidence (0.42); Complex text (readability: 5.8); Rich vocabulary (0.72); Transformer more confident (0.81 vs 0.42),36,257,1,7.138888888888889,en,5.795000000000016,0.7222222222222222,0.0,0.0,0.0,0.0,0,0,0.0,0.421163790443641,Miscellaneous,True,0.008763,0.809188187122345,Administrative rights,True,0.041368
problem with opening files at one com sent tuesday problem with opening files one hi currently we experiencing issues with opening any document located one we have access projects documentation but opening file results into following message with kind regards officer,1,Complex text (readability: 4.3); Rich vocabulary (0.73),41,267,1,6.512195121951219,en,4.273658536585401,0.7317073170731707,0.0,0.0,0.0,0.0,0,0,0.0,0.9240839336348025,Hardware,True,0.008483,0.8764810562133789,Hardware,True,0.053947
lost access card order a new one work lost access card reported took temporary card noticed could you forward case belgrade,1,Rich vocabulary (0.81),21,123,1,5.857142857142857,en,56.6057142857143,0.8095238095238095,0.0,0.0,0.0,0.0,0,0,0.0,0.9862972846265166,Access,True,0.008007,0.9986945986747742,Access,True,0.042143
new purchase tuesday february pm purchase dear purchased spare please log installation please take consideration mandatory receipts section order receive item ordered kind regards administrator,1,Complex text (readability: -1.3); Rich vocabulary (0.92),25,193,1,7.72,en,-1.275999999999982,0.92,0.0,0.0,0.0,0.0,0,0,0.0,0.9792770580814786,Purchase,True,0.007661,0.9985271692276001,Purchase,True,0.049398
ops schedule task schedule task hi please tasks summary triggers weekly example task thank va monitoring engineer,1,Rich vocabulary (0.82),17,113,1,6.647058823529412,en,40.2858823529412,0.8235294117647058,0.0,0.0,0.0,0.0,0,0,0.0,0.8700831435300023,Miscellaneous,True,0.008283,0.9838379621505737,Miscellaneous,True,0.044637
replenishment received shipment please log replenishment number thanks administrator mobile phone wednesday received shipment morn per po,1,Complex text (readability: 20.4); Rich vocabulary (0.82),17,137,1,8.058823529411764,en,20.380000000000024,0.8235294117647058,0.0,0.0,0.0,0.0,0,0,0.0,0.8997975453266994,Purchase,True,0.008109,0.9967377781867981,Purchase,True,0.055517
critical alert original message sent tuesday july critical alert following alert occurred status active data source type data source be be computer be description last recovery points created protection agent be was temporarily unable respond because was unexpected for more information open administrator console review alert details monitoring task area,1,Low TF-IDF confidence (0.53); Complex text (readability: -28.3); Rich vocabulary (0.80); Transformer more confident (0.80 vs 0.53),50,355,1,7.1,en,-28.34299999999999,0.8,0.0,0.0,0.0,0.0,0,0,0.0,0.5316714855542336,Miscellaneous,True,0.007696,0.800726592540741,Hardware,True,0.062572
line manager and expense report assignment request expense report assignment hi dear please change left afterwards please move expense report please attached approve please let help kind regards lead,1,Rich vocabulary (0.72),29,199,1,6.862068965517241,en,40.2896551724138,0.7241379310344828,0.0,0.0,0.0,0.0,0,0,0.0,0.9500240924756532,Miscellaneous,True,0.007734,0.9976944327354431,Miscellaneous,True,0.055555
new pas sent thursday november hi can log into could you please check if something wrong with thank you manager,1,Low TF-IDF confidence (0.41); Rich vocabulary (0.95),20,111,1,5.55,en,72.32500000000003,0.95,0.0,0.0,0.0,0.0,0,0,0.0,0.4099550675554899,Hardware,True,0.007729,0.9974756836891174,Hardware,True,0.044177
change azure machine change azure machine hi please make azure machines azure both drive please assign thanks design lead ext,1,Low TF-IDF confidence (0.61); Transformer more confident (0.79 vs 0.61),20,125,1,6.25,en,63.86500000000004,0.7,0.0,0.0,0.0,0.0,0,0,0.0,0.6091337035638482,Miscellaneous,True,0.008007,0.7867398262023926,Hardware,True,0.047701
rejected expense report approval for sent friday rejected expense report approval for hello dears please help with below raised expense report attached files submitted receipts but other end cannot attachments can you please investigate thanks sent rejected expense report approval for access task application expense report approval for details assignee assigned date outcome reject task number report period report total approximately submission date purpose expense items miscellaneous dishes for site task cost center itemized comments data display data display report history person date status notes task assigned expense report rejected by your manager,1,Complex text (readability: -51.3),93,659,1,7.086021505376344,en,-51.30193548387096,0.6344086021505376,0.0,0.0,0.0,0.0,0,0,0.0,0.966564203824116,Miscellaneous,True,0.008358,0.9980648159980774,Miscellaneous,True,0.067961
update all users list wednesday october update users please log run script update users,1,Rich vocabulary (0.71),14,87,1,6.214285714285714,en,53.639285714285734,0.7142857142857143,0.0,0.0,0.0,0.0,0,0,0.0,0.8702671054826185,Access,True,0.009358,0.9961614608764648,Access,True,0.04183
issue with work computer issue with work computer dear already for week have issue with work computer with connection browser calls via etc please help possible thank you regards manager en,1,Complex text (readability: 28.0); Rich vocabulary (0.71),31,189,1,6.096774193548387,en,28.002258064516155,0.7096774193548387,0.0,0.0,0.0,0.0,0,0,0.0,0.9737125639897639,Hardware,True,0.00824,0.9933597445487976,Hardware,True,0.039331
rights into pm re rights hi please consider want how done during absence want let approvals currently contracts opportunities tanks pm rights hi please give same permissions thank blvd please note holiday public holiday tuesday,1,Low TF-IDF confidence (0.54); Complex text (readability: 23.9); Rich vocabulary (0.77); Transformer more confident (0.92 vs 0.54),35,227,1,6.485714285714286,en,23.864285714285728,0.7714285714285715,0.0,0.0,0.0,0.0,0,0,0.0,0.5364718904475251,Miscellaneous,True,0.008354,0.9218950867652893,Storage,True,0.042997
access request for thursday pm library requesting library links library manage setting library head testing discipline note site site site provides central storage collaboration information ideas site tool collaboration tool communication meeting tool decision making site helps groups work teams social groups share information work together example site help coordinate calendars schedules discuss ideas review proposals share information keep touch other sites dynamic interactive members site contribute own ideas content well comment contribute other,1,Complex text (readability: -46.6); Rich vocabulary (0.72),74,555,1,7.5,en,-46.62094594594589,0.7162162162162162,0.0,0.0,0.0,0.0,0,0,0.0,0.84109814622431,Hardware,True,0.008043,0.9012994170188904,Hardware,True,0.069721
user rights wednesday march pm user rights hi please rights user gave him pipeline he he tries he receives thanks,0,"Default to TF-IDF (simple, confident case)",20,113,1,5.65,en,72.32500000000003,0.7,0.0,0.0,0.0,0.0,0,0,0.0,0.9179790514636219,Access,True,0.012756,0.7799174189567566,Access,True,0.044365
project field not available for update sent tuesday field available for update hi when we move bug progress done screen below we have fill covered by field with value after we update press complete field cannot be found anywhere for later update can you please make field visible for purposes thank you master en,1,Low TF-IDF confidence (0.42); Complex text (readability: 25.1); Rich vocabulary (0.74),54,312,1,5.777777777777778,en,25.125000000000014,0.7407407407407407,0.0,0.0,0.0,0.0,0,0,0.0,0.4200573940803423,Hardware,True,0.007546,0.9934713840484619,Hardware,True,0.059618
suspend access card for maternity leaver advised maternity leave,1,Complex text (readability: 19.1); Rich vocabulary (0.89),9,64,1,7.111111111111111,en,19.100000000000023,0.8888888888888888,0.0,0.0,0.0,0.0,0,0,0.0,0.9279188895365182,HR Support,True,0.011383,0.9753084182739258,HR Support,True,0.03809
access information request friday july hi want code currently also trigger jobs pull merge question creating jobs give create jobs both second repositories engine dashboard job each repository also release job total jobs process thanks senior software developer,1,Complex text (readability: 5.7); Rich vocabulary (0.87),38,261,1,6.868421052631579,en,5.7439473684210895,0.868421052631579,0.0,0.0,0.0,0.0,0,0,0.0,0.8527421040216405,Access,True,0.008385,0.9828715324401855,Access,True,0.047425
new starter belgrade wednesday pm hello please find attached joiner thank regards administrator,1,Rich vocabulary (1.00),13,95,1,7.3076923076923075,en,30.947692307692336,1.0,0.0,0.0,0.0,0.0,0,0,0.0,0.9801800297348539,HR Support,True,0.00782,0.9987882971763611,HR Support,True,0.046246
for call issues for call issues hi starting monday have issues using for use call functionality after restart computer was able call colleagues but still able call meeting big problem already failed join couple meetings please investigate thanks test consultant,1,Complex text (readability: 22.4); Rich vocabulary (0.78),40,261,1,6.525,en,22.41500000000002,0.775,0.0,0.0,0.0,0.0,0,0,0.0,0.9576876898325815,Hardware,True,0.008401,0.9780304431915283,Hardware,True,0.05694
returned purchase requisition for laptop cooler friday returned purchase requisition cooler hello purchase cooler returned feedback allocation help regards developer,1,Low TF-IDF confidence (0.53); Complex text (readability: -8.0); Transformer more confident (0.82 vs 0.53),20,165,1,8.25,en,-8.044999999999959,0.65,0.0,0.0,0.0,0.0,0,0,0.0,0.5326122858583764,Hardware,True,0.008683,0.8185673952102661,Purchase,True,0.0568
card de tuesday pm card si,1,Unsupported language (es); Rich vocabulary (0.83),6,26,1,4.333333333333333,es,87.94500000000002,0.8333333333333334,0.0,0.0,0.0,0.0,0,0,0.0,0.9665316862821607,Access,True,0.007983,0.9986984729766846,Access,True,0.032281
oracle submission issue submission issue dear could you help for know public holidays automatically added receive error saying regards developer en,1,Complex text (readability: 8.3); Rich vocabulary (0.90),21,147,1,7.0,en,8.262857142857143,0.9047619047619048,0.0,0.0,0.0,0.0,0,0,0.0,0.9452913227158743,HR Support,True,0.007992,0.9987565279006958,HR Support,True,0.046794
please action missing time please action hello can you please help with card for receiving lot reminders fact introduced but somehow error status checked morning cannot modify can you something thank you sent monday october please action dear part established processes each required submit his weekly basis each friday for past week must be submitted for approval you receiving because you haven followed process please action possible below breakdown your please log accordingly training materials available here id if by each wednesday there still past period then your manager also be notified country manager for for date total days,1,Complex text (readability: -37.2); Rich vocabulary (0.76),99,637,1,6.434343434343434,en,-37.21363636363634,0.7575757575757576,0.0,0.0,0.0,0.0,0,0,0.0,0.7648573613477007,HR Support,True,0.008125,0.9728940725326538,HR Support,True,0.088764
new purchase po purchase po dear purchased updated include device under user name link please add allocation device thanks after receive item please take consideration mandatory receipts section order receive item ordered how video link please receipt number item needed processed kind regards administrator,1,Complex text (readability: -1.3); Rich vocabulary (0.80),44,307,1,6.9772727272727275,en,-1.2568181818181756,0.7954545454545454,0.0,0.0,0.0,0.0,0,0,0.0,0.9897298830534063,Purchase,True,0.008013,0.9985663294792175,Purchase,True,0.063805
outlook sporadically send certain invites have attached error message calendar invite for apparent reason parked outbox sent monday incident escalated more two teams fusion hi can you please get back advise why ticket resolved log incident for hold incident sent monday sporadically send certain invites hello please be advised tried reproduce described below behavior test machine issues or interruptions were observed could you please let know if issue reoccurred when happened last best regards senior engineer thank you sent monday incident escalated more two teams fusion ticket assigned more than two teams fusion hi please be advised following ticket assigned more than two teams fusion reference number summary sporadically send certain invites survey scores issue still resolved kind regards ext,1,Low TF-IDF confidence (0.70); Long text (120 words); Complex text (readability: -61.6),120,804,1,6.7,en,-61.60499999999996,0.6333333333333333,0.0,0.0,0.0,0.0,0,0,0.0,0.6973786728305968,Miscellaneous,True,0.008695,0.5390375256538391,Miscellaneous,True,0.122743
open hello intern receive work tasks best regards intern tester,1,Low TF-IDF confidence (0.67); Rich vocabulary (0.90),10,63,1,6.3,en,52.86500000000001,0.9,0.0,0.0,0.0,0.0,0,0,0.0,0.6693608352876641,HR Support,True,0.007566,0.9987000226974487,HR Support,True,0.035908
outlook error message sent monday error message hello need your assistance with error message got when use please below can you please advise what means what need fix thank you infrastructure manager,1,Low TF-IDF confidence (0.53); Rich vocabulary (0.75),32,199,1,6.21875,en,42.16750000000002,0.75,0.0,0.0,0.0,0.0,0,0,0.0,0.5312253468330675,Administrative rights,True,0.008205,0.9863879680633545,Administrative rights,True,0.055736
oracle for staff on maternity wednesday november pm re maternity hi record inactive required believe instructed make changes ago backlog yet please advise update record status july required thanks,1,Complex text (readability: 5.3); Rich vocabulary (0.90),29,196,1,6.758620689655173,en,5.282758620689691,0.896551724137931,0.0,0.0,0.0,0.0,0,0,0.0,0.8123450930764138,HR Support,True,0.008018,0.9698500037193298,HR Support,True,0.060164
project assignment oracle wednesday assignment please assign myself canada regards director,1,Low TF-IDF confidence (0.74); Complex text (readability: -4.3); Rich vocabulary (0.91),11,91,1,8.272727272727273,en,-4.293636363636352,0.9090909090909091,0.0,0.0,0.0,0.0,0,0,0.0,0.7393143519643798,Internal Project,True,0.008088,0.8451080918312073,Internal Project,True,0.035115
license request architect wednesday july pm architect hello provide license architect thank digital solution architect,1,Complex text (readability: -5.8); Rich vocabulary (0.73),15,118,1,7.866666666666666,en,-5.789999999999992,0.7333333333333333,0.0,0.0,0.0,0.0,0,0,0.0,0.9672612784075125,Access,True,0.010302,0.9989192485809326,Access,True,0.041451
sales owner change sales owner change hi there trying update sales owner record needs change myself but every make change hangs then crashes seems for other updates thanks,1,Rich vocabulary (0.75),28,171,1,6.107142857142857,en,57.55785714285717,0.75,0.0,0.0,0.0,0.0,0,0,0.0,0.9650651790343984,Miscellaneous,True,0.007888,0.9982752799987793,Miscellaneous,True,0.045141
access to location location hi please provide layouts source ancient polls thank analyst ext,1,Low TF-IDF confidence (0.63); Rich vocabulary (0.93),14,92,1,6.571428571428571,en,47.59642857142859,0.9285714285714286,0.0,0.0,0.0,0.0,0,0,0.0,0.6250818360294886,HR Support,True,0.009782,0.992633044719696,HR Support,True,0.03813
