Document,router_label,reason,word_count,char_count,sentence_count,avg_word_length,language,readability,vocabulary_richness,special_char_ratio,number_ratio,punctuation_density,capital_ratio,has_email,has_phone,proper_noun_ratio,tfidf_confidence,tfidf_prediction,tfidf_success,tfidf_latency,transformer_confidence,transformer_prediction,transformer_success,transformer_latency
po incomplete inactive requester tuesday october pm po incomplete inactive requester hello raised created po requisition active anymore po incomplete cannot process invoice close po best regards sp tar shared officer ext st,1,Low TF-IDF confidence (0.73); Complex text (readability: 4.1); Rich vocabulary (0.76),33,223,1,6.757575757575758,en,4.140000000000015,0.7575757575757576,0.0,0.0,0.0,0.0,0,0,0.0,0.7346065035505884,Purchase,True,0.007811,0.9921823143959045,Purchase,True,0.049387
outlook issue sent tuesday july issue hi need your help dear back after weeks holidays unable access mails window please enter your password constantly appearing thank you for your help best regards manager can you please check raise ticket for thank you kind regards defect manager,1,Complex text (readability: 27.7); Rich vocabulary (0.76),46,282,1,6.130434782608695,en,27.72760869565218,0.7608695652173914,0.0,0.0,0.0,0.0,0,0,0.0,0.8952103822223932,Administrative rights,True,0.008185,0.9916715025901794,Administrative rights,True,0.052678
access needed tuesday la flow si unauthorized va lead,1,Rich vocabulary (1.00),9,53,1,5.888888888888889,en,56.70000000000002,1.0,0.0,0.0,0.0,0.0,0,0,0.0,0.9053887756146173,Hardware,True,0.007957,0.9951130747795105,Hardware,True,0.061311
display receiver connection connecting dear plugged cable working well installer cables told issue solve checked find out issue depending different kind notebooks working find backup bought display receiver connect connect without help october european help better solution br main main,1,Complex text (readability: 7.6); Rich vocabulary (0.80),40,286,1,7.15,en,7.610000000000014,0.8,0.0,0.0,0.0,0.0,0,0,0.0,0.9674661782420639,Hardware,True,0.0077,0.9981427192687988,Hardware,True,0.065859
new backpack november backpack hello requested today backpack received almost years ago has degraded thanks developer,1,Complex text (readability: 16.1); Rich vocabulary (0.88),16,117,1,7.3125,en,16.107500000000016,0.875,0.0,0.0,0.0,0.0,0,0,0.0,0.949923946858509,Hardware,True,0.008414,0.9985575079917908,Hardware,True,0.04243
add member into com pm add member hello please add thank,1,Rich vocabulary (0.73),11,56,1,5.090909090909091,en,72.61545454545457,0.7272727272727273,0.0,0.0,0.0,0.0,0,0,0.0,0.9732594521156143,Miscellaneous,True,0.008114,0.9980714917182922,Miscellaneous,True,0.03772
new project code oracle fusion pre code deck hello please attached form setup pre usual pre tasks client deck thank,1,Rich vocabulary (0.80),20,115,1,5.75,en,59.63500000000003,0.8,0.0,0.0,0.0,0.0,0,0,0.0,0.9803554204965825,Internal Project,True,0.011303,0.9973391890525818,Internal Project,True,0.050592
open connection failed open connection failed hi trying connect but get error can anyone help with issue thanks regards,1,Rich vocabulary (0.84),19,119,1,6.2631578947368425,en,45.06578947368425,0.8421052631578947,0.0,0.0,0.0,0.0,0,0,0.0,0.9742030685880252,Hardware,True,0.010658,0.998638927936554,Hardware,True,0.040286
ms it support team box as recipient for notifications wednesday february pm warning hello please add kind recipient thank regards leader wednesday february pm warning close breaching please advised unassigned close breaching reference number summary failing priority moderate resolution target date assigned engineer unassigned ref msg,1,Complex text (readability: -14.6); Rich vocabulary (0.80),46,335,1,7.282608695652174,en,-14.572391304347803,0.8043478260869565,0.0,0.0,0.0,0.0,0,0,0.0,0.954627070909436,Miscellaneous,True,0.015783,0.9978493452072144,Miscellaneous,True,0.077038
approvals oracle stuck approvals stuck following requisitions won open know why can approve or dismiss could you find out why chief officer,1,Rich vocabulary (0.86),22,139,1,6.318181818181818,en,38.37772727272727,0.8636363636363636,0.0,0.0,0.0,0.0,0,0,0.0,0.9381707374454876,Miscellaneous,True,0.008272,0.9980474710464478,Miscellaneous,True,0.053399
project code pm code hello starting rd part please assign her code thank,1,Rich vocabulary (0.85),13,72,1,5.538461538461538,en,76.50153846153849,0.8461538461538461,0.0,0.0,0.0,0.0,0,0,0.0,0.9913678394951335,Internal Project,True,0.009976,0.997502863407135,Internal Project,True,0.039778
engineers cannot connect to servers engineers cannot connect hello please ensure engineers connect currently permissions details attached marked regards owner,1,Complex text (readability: 8.9); Rich vocabulary (0.75),20,158,1,7.9,en,8.875000000000028,0.75,0.0,0.0,0.0,0.0,0,0,0.0,0.9340690792667303,Hardware,True,0.010642,0.9979280233383179,Hardware,True,0.052246
access administrators said permission log think incorrect please administrators by,1,Low TF-IDF confidence (0.68); Complex text (readability: 2.1); Rich vocabulary (0.90),10,82,1,8.2,en,2.105000000000018,0.9,0.0,0.0,0.0,0.0,0,0,0.0,0.682390877474922,Hardware,True,0.010267,0.9301370978355408,Hardware,True,0.038645
end project setup form oracle and pas new people engagement communications pas setup form engagement communications platform hi please setup code attached offers recovery sub type central thanks please refer section entities,1,Complex text (readability: 13.1); Rich vocabulary (0.78),32,224,1,7.0,en,13.086250000000035,0.78125,0.0,0.0,0.0,0.0,0,0,0.0,0.9373066913744745,Internal Project,True,0.010146,0.9968852400779724,Internal Project,True,0.109496
connection not working status showing up connecting since while icon yellow know why connected yet,1,Rich vocabulary (1.00),15,98,1,6.533333333333333,en,44.97000000000003,1.0,0.0,0.0,0.0,0.0,0,0,0.0,0.9551857583546782,Hardware,True,0.008699,0.9954972267150879,Hardware,True,0.041279
access cards pm card si ca card card si,1,Unsupported language (it),9,39,1,4.333333333333333,it,94.30000000000001,0.6666666666666666,0.0,0.0,0.0,0.0,0,0,0.0,0.9947836416078861,Access,True,0.007777,0.9986252784729004,Access,True,0.032171
live database tuesday database importance high hi instance database backup restored environment urgent please possible software consultant,1,Complex text (readability: 0.5); Rich vocabulary (0.88),17,138,1,8.117647058823529,en,0.47411764705884707,0.8823529411764706,0.0,0.0,0.0,0.0,0,0,0.0,0.8495557616807332,Hardware,True,0.010126,0.9885629415512085,Hardware,True,0.044722
backup failure local virtual server virtual server failure reason error code was successful but job did fully complete successfully source process error code os mount failed source process files failed back up none virtual server copy protected virtual machines total virtual machines successful virtual machines failed virtual machines virtual machines partially successful virtual machines powered off by job failed failure reason error registering virtual machine,1,Complex text (readability: -25.7),65,466,1,7.1692307692307695,en,-25.736923076923063,0.5384615384615384,0.0,0.0,0.0,0.0,0,0,0.0,0.9013893123192487,Hardware,True,0.008239,0.7051393985748291,Hardware,True,0.064238
access friday hi please activate ref today her role let kind regards,1,Low TF-IDF confidence (0.62); Rich vocabulary (1.00),12,68,1,5.666666666666667,en,67.75500000000001,1.0,0.0,0.0,0.0,0.0,0,0,0.0,0.6175193966449452,HR Support,True,0.007802,0.9622995853424072,HR Support,True,0.039484
confluence access wednesday pm confluence hello working confluence further details thank,1,Complex text (readability: 11.1); Rich vocabulary (0.82),11,88,1,8.0,en,11.088181818181852,0.8181818181818182,0.0,0.0,0.0,0.0,0,0,0.0,0.997947667882403,Access,True,0.009056,0.9990179538726807,Access,True,0.038284
access friday pm logging hi connect log file attached understand authentication problem carefully insert credentials problem how solved,1,Complex text (readability: 14.7); Rich vocabulary (0.94),18,135,1,7.5,en,14.66500000000002,0.9444444444444444,0.0,0.0,0.0,0.0,0,0,0.0,0.9752093605493484,Hardware,True,0.008042,0.9958131909370422,Hardware,True,0.048207
can scroll down to all data sent tuesday october can scroll down data hi guys there problem when trying scroll bottom data screens or thanks client manager,1,Rich vocabulary (0.78),27,155,1,5.7407407407407405,en,57.23000000000002,0.7777777777777778,0.0,0.0,0.0,0.0,0,0,0.0,0.8048020255843454,Hardware,True,0.008125,0.8072474002838135,Administrative rights,True,0.054001
not able to submit time sheet due to job tittle settings sent friday re update error sheet update if known but error displayed review submit screen most likely caused by job title please attached sent thursday re update error sheet hello thank you for your response very fast appreciate but have problem lets complete for days problematic week except for friday after complete right details shows string instead code attached print screen for you think because these get another error when try review submit sent thursday update error sheet dear further our recent communication we believe your below query resolved if you with resolution there need for response however please let know if we can be any further assistance matter reference number summary error sheet resolver description sent thursday re sheet hi unfortunately succeeded making modification you suggested delete option available for week with error please attached print screen whenever you have some please contact thanks sent wednesday sheet hello order delete problematic week could you please go manage cards select cards period select row entry section options actions section become editable there you can delete week for got moved weekend create week go manage cards again actions create calendar please select st problematic week week can be generated please try fill sheet after done click next then submit if anything unclear feel free contact for looking forward hearing you analyst ext hub sent tuesday re sheet hello tried log application succeeded for some days but for last week for monday tuesday adds thursday for wednesday adds saturday can you help with look have hours logged for thursday can delete thanks sent friday sheet hello your created if you report message for your st days without possibility enter code please let know note issue tracked by our rd party provider you be able log your properly only for weeks following your start date please let know if you experience issue described above thank you for your understanding analyst ext hub sent monday sheet dear welcome we wish you wonderful here unfortunately moment we only have one colleague assigned working tasks due work load there delays your starter ticket for yet processed why you able log into once your created you be notified we apologize for inconvenience caused thank you for understanding regards analyst ext hub sent friday sheet hello please help with verification for when try log get following error please attached print screen name thanks kind regards ext,1,Low TF-IDF confidence (0.64); Long text (409 words); Complex text (readability: -343.0),409,2525,1,6.17359413202934,en,-342.95672371638136,0.4889975550122249,0.0,0.0,0.0,0.0,0,0,0.0,0.6351565345296197,HR Support,True,0.008859,0.9972881078720093,HR Support,True,0.316182
new starter bogota friday re complete colombia hi please find completed cheers head thursday pm complete colombia importance high dear please help completed form developer senior technician joining thank compliance officer colombia,1,Complex text (readability: -0.1); Rich vocabulary (0.84),32,231,1,7.21875,en,-0.13249999999996476,0.84375,0.0,0.0,0.0,0.0,0,0,0.0,0.9500877558715815,HR Support,True,0.007988,0.9986660480499268,HR Support,True,0.067897
issue sent friday issue dear unable create branch previously was able needed repository discovered attached image yesterday had received laptop same issue with please help developer,1,Low TF-IDF confidence (0.68); Complex text (readability: 8.0); Rich vocabulary (0.92),26,181,1,6.961538461538462,en,7.991153846153878,0.9230769230769231,0.0,0.0,0.0,0.0,0,0,0.0,0.6767006455244765,Access,True,0.008348,0.8351965546607971,Access,True,0.050444
of hi discussed win upgrade since installed drive manner create please,1,Rich vocabulary (1.00),11,70,1,6.363636363636363,en,72.61545454545457,1.0,0.0,0.0,0.0,0.0,0,0,0.0,0.9510715696936195,Administrative rights,True,0.008125,0.9906004667282104,Administrative rights,True,0.042918
access saturday pm importance high hi problem cannot forms please help thank officer floor blvd district,1,Rich vocabulary (1.00),16,104,1,6.5,en,37.25750000000002,1.0,0.0,0.0,0.0,0.0,0,0,0.0,0.7665023649836475,HR Support,True,0.011538,0.96678626537323,HR Support,True,0.043432
access card not working on tourniquets sent friday march la va manager hello visitor access card working tourniquets could you please situation thank you,1,Rich vocabulary (0.79),24,153,1,6.375,en,45.00000000000003,0.7916666666666666,0.0,0.0,0.0,0.0,0,0,0.0,0.9902996293601092,Access,True,0.010525,0.9984330534934998,Access,True,0.047598
new purchase po pm purchase po dear purchased please log allocation please take consideration mandatory receipts section order receive item ordered how video explorer kind regards administrator,1,Complex text (readability: 4.0); Rich vocabulary (0.89),27,193,1,7.148148148148148,en,3.9633333333333667,0.8888888888888888,0.0,0.0,0.0,0.0,0,0,0.0,0.9896178335833563,Purchase,True,0.010397,0.9985761642456055,Purchase,True,0.049335
can you please delete from oracle time can you please delete hello can you please help thanks developer en,0,"Default to TF-IDF (simple, confident case)",19,106,1,5.578947368421052,en,67.32894736842107,0.631578947368421,0.0,0.0,0.0,0.0,0,0,0.0,0.9611286010122729,HR Support,True,0.007962,0.9983183145523071,HR Support,True,0.046832
testing desktop needed en tuesday july pm testing needed dear please log assign providing testing thank kind regards engineer,1,Low TF-IDF confidence (0.68); Rich vocabulary (0.84); Transformer more confident (0.79 vs 0.68),19,125,1,6.578947368421052,en,36.1605263157895,0.8421052631578947,0.0,0.0,0.0,0.0,0,0,0.0,0.6842399008865899,Hardware,True,0.008274,0.7937560677528381,HR Support,True,0.045354
oracle fusion forward expense claims for and to thursday november pm re change importance high hi please perform same change well back done thanks kind regards accountant ext november change hi has left replaced by unfortunately expense claims approvals stuck please reassign everything asap issue has raised ago nothing has done thank kind regards accountant ext,1,Complex text (readability: 8.0); Rich vocabulary (0.75),56,363,1,6.482142857142857,en,7.987857142857166,0.75,0.0,0.0,0.0,0.0,0,0,0.0,0.8625162493667753,Miscellaneous,True,0.008106,0.995844304561615,Miscellaneous,True,0.076239
fusion downtime thursday downtime hello please find attached form migration impact much best regards,1,Low TF-IDF confidence (0.59); Rich vocabulary (0.93),14,100,1,7.142857142857143,en,47.59642857142859,0.9285714285714286,0.0,0.0,0.0,0.0,0,0,0.0,0.5905951365175252,Hardware,True,0.007658,0.4959190785884857,Hardware,True,0.042238
missing from pas sent wednesday hi can you please open ticket investigate why our client under opportunity was created end we unable add our forecasts against here their client entry thanks vice president,1,Low TF-IDF confidence (0.54); Complex text (readability: 24.6); Rich vocabulary (0.94),33,204,1,6.181818181818182,en,24.649090909090916,0.9393939393939394,0.0,0.0,0.0,0.0,0,0,0.0,0.5396435328230292,Miscellaneous,True,0.008188,0.9487168788909912,Miscellaneous,True,0.052979
critical alerts notifications following alert occurred status active description tape failed failed perform operation since tape free tape available tape library based for more information open administrator console review alert details monitoring task area,1,Low TF-IDF confidence (0.50); Complex text (readability: -14.3); Rich vocabulary (0.85); Transformer more confident (0.99 vs 0.50),34,257,1,7.5588235294117645,en,-14.292647058823519,0.8529411764705882,0.0,0.0,0.0,0.0,0,0,0.0,0.501717392428975,HR Support,True,0.010223,0.9924498796463013,Miscellaneous,True,0.041374
windows upgrade error upgrade analyst ext sent tuesday october re upgrade hi tried performing upgrade few weeks ago when had required amount space available following task sequence error occurred during installation process since then multiple updates took place can barely reach amount free even after deleting some irrelevant data some received files etc or after using disk cleanup have saved relevant data partition probably only fresh installation would solve please let know how should proceed next thank you senior tester sent tuesday october upgrade hello if you already upgraded your os please ignore also if you member teams please apply upgrade yet thank you you receiving because we approaching scheduled for forced upgrade assets migrated yet before performing upgrade your please document found here carefully attention screen below please contact or should you require any further assistance best regards ext,1,Long text (140 words); Complex text (readability: -84.5); Rich vocabulary (0.76),140,923,1,6.5928571428571425,en,-84.52357142857139,0.7642857142857142,0.0,0.0,0.0,0.0,0,0,0.0,0.9174453182296066,Administrative rights,True,0.008284,0.9925310015678406,Administrative rights,True,0.088487
change value survey please amend values changed fatal error fatal error thank,1,Low TF-IDF confidence (0.47); Rich vocabulary (0.83),12,77,1,6.416666666666667,en,53.655,0.8333333333333334,0.0,0.0,0.0,0.0,0,0,0.0,0.4711782568537409,HR Support,True,0.010775,0.5669844150543213,Miscellaneous,True,0.04751
access cards for integration team issue sent wednesday november logged access cards for integration hello per our phone conversation can you please provide access floors below thank you manager sent thursday november logged access cards for integration welcome we help dear thank you for contacting we endeavour find resolution your query timely manner your request for assistance entered into our with following details reference number summary access cards for integration priority priority resolution target date incident description sent thursday november access cards for integration hello can you please help with access card for integration below you can find names for cards thank you manager if you would like discuss priority or add further information query please contact you can track progress request via following link member be contact with you shortly progress query kind regards ext hub ref msg,1,Long text (139 words); Complex text (readability: -84.6),139,912,1,6.561151079136691,en,-84.58237410071939,0.539568345323741,0.0,0.0,0.0,0.0,0,0,0.0,0.8347250387707229,Access,True,0.008034,0.9514824748039246,Access,True,0.121276
name correction tuesday name correction dear identified spelling error name instead appeared until please make updates thank administration officer,1,Low TF-IDF confidence (0.68); Complex text (readability: 13.9); Rich vocabulary (0.84); Transformer more confident (1.00 vs 0.68),19,147,1,7.7368421052631575,en,13.897368421052647,0.8421052631578947,0.0,0.0,0.0,0.0,0,0,0.0,0.6839263531118758,HR Support,True,0.008119,0.9977496266365051,Miscellaneous,True,0.041193
role for projects oracle wednesday dear please ask created accounts role same rights moment thank program upcoming leave thursday st returning tuesday thursday pm re hello please corrected versions files margin thank program upcoming leave thursday st returning tuesday thursday pm hello please ask help create attached ready starting next thank program upcoming leave thursday st returning tuesday thursday hello please kind help out by providing details regarding how fill setup form she fill details creation please attached form let helps further details needed after confirms details please proceed usual assign appropriate thank best regards leader ext,1,Low TF-IDF confidence (0.74); Complex text (readability: -37.3),97,658,1,6.783505154639175,en,-37.271546391752565,0.6185567010309279,0.0,0.0,0.0,0.0,0,0,0.0,0.7381611506741488,Internal Project,True,0.008027,0.8872212767601013,Internal Project,True,0.106242
oracle approvals approvals has assigned hello please log call thank best regards analyst,1,Rich vocabulary (0.92),13,88,1,6.769230769230769,en,37.455384615384645,0.9230769230769231,0.0,0.0,0.0,0.0,0,0,0.0,0.8418689571307395,Miscellaneous,True,0.007863,0.9971613883972168,Miscellaneous,True,0.041759
monitor request monitor hello please provide monitor because relocated tower thank much,1,Complex text (readability: 11.4); Rich vocabulary (0.83),12,87,1,7.25,en,11.355000000000018,0.8333333333333334,0.0,0.0,0.0,0.0,0,0,0.0,0.9906927551979393,Hardware,True,0.007826,0.9988246560096741,Hardware,True,0.038039
ms senior managers list november senior hello currently two lists both which incorrect please delete senior add senior please also add users write emergency cab regards,1,Rich vocabulary (0.81),26,168,1,6.461538461538462,en,30.76807692307696,0.8076923076923077,0.0,0.0,0.0,0.0,0,0,0.0,0.9303565116895613,Miscellaneous,True,0.008462,0.9948994517326355,Miscellaneous,True,0.056178
ownership on turners team friday pm ownership hi please make owner leaving she needs add members thank senior tester,1,Rich vocabulary (0.95),19,116,1,6.105263157894737,en,49.518421052631595,0.9473684210526315,0.0,0.0,0.0,0.0,0,0,0.0,0.9809020663653923,Miscellaneous,True,0.007811,0.9978253841400146,Miscellaneous,True,0.050227
buyer role tuesday pm buyer role hi please best regards analyst tuesday pm buyer role hello please buyer role thank specialist,1,Low TF-IDF confidence (0.54); Transformer more confident (0.70 vs 0.54),21,126,1,6.0,en,44.52000000000001,0.5714285714285714,0.0,0.0,0.0,0.0,0,0,0.0,0.5376382896950879,HR Support,True,0.007673,0.7039018869400024,Access,True,0.050976
new pas issues for speed sent thursday october re issues for speed hello can you please log ticket for kind regards application developer sent thursday october issues for speed hi far have found following issues for where need your help there something strange with logging should have days logged each month but currently there two for there days logged for days days correct should be fixed checked there such logging days days least available logged days instead correctly logged fusion logged days instead by mistake she logged working was holiday fixed would be good if we could correct data log hours per due paternity leave correct treat these days full case for everybody except would be good fix for well case there should be days logged update forecasts but changes reflected report amount forecasted days changing would be really good if we could fix these issues thank you for your help manager,1,Low TF-IDF confidence (0.59); Long text (152 words); Complex text (readability: -67.7),152,906,1,5.9605263157894735,en,-67.6660526315789,0.5723684210526315,0.0,0.0,0.0,0.0,0,0,0.0,0.5943792289822114,HR Support,True,0.008535,0.5628630518913269,HR Support,True,0.127761
create friday pm create hello please create called templates accessible everybody within give write please assign thanks coordinator,1,Low TF-IDF confidence (0.52); Complex text (readability: 14.7); Rich vocabulary (0.83),18,132,1,7.333333333333333,en,14.66500000000002,0.8333333333333334,0.0,0.0,0.0,0.0,0,0,0.0,0.522217032151063,Access,True,0.008105,0.9410163164138794,Access,True,0.045749
outlook issues sent friday february please can you help with situation appeared morning recurrent every few minutes even if cancel thank you specialist mobile en address blvd th floor district sent friday february hello la interval minute tot va cum ii pot disable specialist mobile en address blvd th floor district,1,Low TF-IDF confidence (0.65); Complex text (readability: -2.5); Rich vocabulary (0.76),51,316,1,6.196078431372549,en,-2.5182352941176305,0.7647058823529411,0.0,0.0,0.0,0.0,0,0,0.0,0.6490057796867286,Administrative rights,True,0.008342,0.9903510212898254,Administrative rights,True,0.070589
possible tuesday pm please attached hi received attached valid assume supposed expecting please let secure thank officer,1,Rich vocabulary (0.88),17,120,1,7.0588235294117645,en,30.332941176470626,0.8823529411764706,0.0,0.0,0.0,0.0,0,0,0.0,0.8999642678255395,HR Support,True,0.008009,0.996874213218689,HR Support,True,0.056537
access to folder folder dear folder bonus other accruals by way thanks,1,Rich vocabulary (0.83),12,70,1,5.833333333333333,en,53.655,0.8333333333333334,0.0,0.0,0.0,0.0,0,0,0.0,0.9970284749805959,Storage,True,0.007783,0.9967189431190491,Storage,True,0.05123
