Document,router_label,reason,word_count,char_count,sentence_count,avg_word_length,language,readability,vocabulary_richness,special_char_ratio,number_ratio,punctuation_density,capital_ratio,has_email,has_phone,proper_noun_ratio,tfidf_confidence,tfidf_prediction,tfidf_success,tfidf_latency,transformer_confidence,transformer_prediction,transformer_success,transformer_latency
account confluence july pm hi developer confluence etc thanks,1,Complex text (readability: -9.1); Rich vocabulary (0.89),9,61,1,6.777777777777778,en,-9.099999999999994,0.8888888888888888,0.0,0.0,0.0,0.0,0,0,0.0,0.9947778218624883,Access,True,0.007543,0.9990653395652771,Access,True,0.030538
new code to be created friday code created dear please also queue thank kind regards code created hello please advised has added queue kind regards analyst ext hub thursday pm re code created hi again guys please ignore filled out form please attached kindly let kind regards thursday pm re code created hi clarify additional code under existing client has other codes other fill out form want completely separate client reacted code kind regards thursday pm code created hello respect please fill out form found link thank analyst ext hub thursday pm code created hello code book against please create application approvals questions please let kind regards,1,Long text (107 words); Complex text (readability: -40.9),107,658,1,6.149532710280374,en,-40.925140186915854,0.5046728971962616,0.0,0.0,0.0,0.0,0,0,0.0,0.8784672043064212,Internal Project,True,0.008016,0.9974125027656555,Internal Project,True,0.073996
add laptop to thursday pm add hello which also received today want add well provide order working thing think adapter please let needed,1,Rich vocabulary (0.91),23,135,1,5.869565217391305,en,51.07260869565218,0.9130434782608695,0.0,0.0,0.0,0.0,0,0,0.0,0.9198448988606861,Hardware,True,0.009575,0.9967408776283264,Hardware,True,0.095662
needed friday needed hi understand order installed please let thanks kind regards accountant ext,1,Low TF-IDF confidence (0.51); Rich vocabulary (0.93),14,96,1,6.857142857142857,en,47.59642857142859,0.9285714285714286,0.0,0.0,0.0,0.0,0,0,0.0,0.5064979859827056,Purchase,True,0.012161,0.48565763235092163,Hardware,True,0.032134
time sheet error oracle wednesday pm sheet error hi guys please resolve error screen adjust sheet thanks client,1,Rich vocabulary (0.78),18,111,1,6.166666666666667,en,56.965,0.7777777777777778,0.0,0.0,0.0,0.0,0,0,0.0,0.9711617095317461,HR Support,True,0.010566,0.9983687996864319,HR Support,True,0.032876
laptop for new starter july importance high care va workstation se floor number table seat number per maps seat design lead,1,Rich vocabulary (0.90),21,123,1,5.857142857142857,en,52.57714285714289,0.9047619047619048,0.0,0.0,0.0,0.0,0,0,0.0,0.7846890163267384,Hardware,True,0.009966,0.99149090051651,Hardware,True,0.040347
leaver for friday july re leaver hi sorry about wrong form attached termination best regards friday july re leaver hi please again clear leaving date thank thursday july pm leaver hi leaver friday her termination july effectively attaching leaver form best regards,1,Complex text (readability: 13.1),42,264,1,6.285714285714286,en,13.133571428571457,0.5952380952380952,0.0,0.0,0.0,0.0,0,0,0.0,0.925756376673444,HR Support,True,0.008109,0.9987103939056396,HR Support,True,0.055536
access to location thursday july pm location hi please contribute location approve needed she head discipline thanks agile,1,Low TF-IDF confidence (0.57); Complex text (readability: 24.1); Rich vocabulary (0.89),18,122,1,6.777777777777778,en,24.064999999999998,0.8888888888888888,0.0,0.0,0.0,0.0,0,0,0.0,0.5654403562477364,HR Support,True,0.007593,0.6859862208366394,HR Support,True,0.040742
please action direct reports missing time sent monday re please action direct reports hello like or weeks ago have raised ticket for be remove or be completed order for disappear like tell you still coming thanks sent wednesday please action direct reports dear manager part established processes each required submit his weekly basis each friday for past week must be submitted for approval you receiving because some your direct reports haven followed process please help cascade accordingly gets possible below breakdown your direct reports please note if refers left or maternity other absence leave please contact update person record otherwise please contact person directly submit their manager country for for date total days information confidential be legally privileged intended solely for addressee any opinions expressed mine necessarily represent opinions susceptible interference if you intended recipient any disclosure copying or any action taken or omitted be taken reliance strictly,1,Low TF-IDF confidence (0.53); Long text (148 words); Complex text (readability: -101.2),148,1001,1,6.763513513513513,en,-101.15256756756756,0.6824324324324325,0.0,0.0,0.0,0.0,0,0,0.0,0.5251468603989322,HR Support,True,0.016865,0.9188992381095886,HR Support,True,0.16341
license visual studio pm license visual studio dear please help license visual studio visual studio attached problem best regards engineer,1,Unsupported language (it); Complex text (readability: -3.8),20,138,1,6.9,it,-3.8149999999999693,0.6,0.0,0.0,0.0,0.0,0,0,0.0,0.9916795072835722,Access,True,0.00786,0.9990488886833191,Access,True,0.033868
new purchase po wednesday purchase po dear purchased xxx lh lh transceiver module nm dom please log allocation please take consideration mandatory receipts section order receive item ordered how video kind regards administrator,1,Complex text (readability: 14.4); Rich vocabulary (0.88),33,227,1,6.878787878787879,en,14.394545454545465,0.8787878787878788,0.0,0.0,0.0,0.0,0,0,0.0,0.9806508459594495,Purchase,True,0.007813,0.9985833168029785,Purchase,True,0.047922
delivery failing to com sent thursday re sprint planning materials hi guys could you please investigate what wrong with address why working properly thanks sent thursday re sprint planning materials address keeps bouncing back sent thursday undeliverable re sprint planning materials failed these or groups your message can be delivered because address restricted for more information about issue code diagnostic information for administrators generating server remote server returned resolver authentication required original message headers with server id with server id via transport return path msg ref server tower originating domain version banners checked by server tower with encrypted by with id signature relaxed relaxed subject date message id references content type mime version by with id version cipher bits verify with server id with server id by with server id signature relaxed relaxed selector mb prod with server version cipher with id mb prod with id cohen re sprint planning materials thread topic sprint planning materials thread index oz date message id references accept language en content language en attach yes originating diagnostics mb tho filtering correlation id filtering tenant mb report test report test mb mb forefront forefront report out mb mb prod none en content type related boundary mb mb type alternative mime version hosted id transport mb virus version vendor engine definitions signatures information transmitted including any content communication confidential intended only for use intended recipient or affiliates subsidiaries if you intended recipient you hereby notified any use information contained or transmitted with communication or dissemination or copying communication strictly prohibited if you have received communication error please notify immediately by replying message delete original message,1,Long text (269 words); Complex text (readability: -233.2),269,1858,1,6.907063197026022,en,-233.19851301115236,0.5204460966542751,0.0,0.0,0.0,0.0,0,0,0.0,0.9529168820669046,Hardware,True,0.008405,0.994471549987793,Hardware,True,0.153089
error error for locked with status error after trying please help deleting can correctly enter submit for given period thanks senior consultant,1,Rich vocabulary (0.86),22,143,1,6.5,en,30.686818181818182,0.8636363636363636,0.0,0.0,0.0,0.0,0,0,0.0,0.9627817532337156,HR Support,True,0.007668,0.901332437992096,HR Support,True,0.041075
procurement approval view thursday pm view hello way more meaningful view tab under user display name quite useless especially same useful requisition amount requestor least entered by requisitioning also help,1,Complex text (readability: 15.6); Rich vocabulary (0.93),30,209,1,6.966666666666667,en,15.645000000000039,0.9333333333333333,0.0,0.0,0.0,0.0,0,0,0.0,0.8349667035487922,Miscellaneous,True,0.011155,0.9933171272277832,Miscellaneous,True,0.106284
re open configuration re configuration hi going cr order add please assign queue best regards senior engineer re configuration hi thanks update mo visibility related user connect he except edge which fine user edge user wants anywhere configuration configured also configuration let related configuration environment site role cluster name back back edge edge front front front file mediation mediation persistent chat persistent chat persistent chat persistent chat persistent chat cluster name back back edge edge front front front file mediation mediation persistent chat persistent chat persistent chat persistent chat persistent chat add networks configuration please let make change best regards re configuration hi pushed users none mentioned pushed users regarding checked profile her traffic routed via best regards senior engineer configuration hi configuration addresses back back back edge edge front front front file mediation mediation back back back edge edge front front front file mediation mediation senior infrastructure engineer infrastructure upcoming holiday none,1,Low TF-IDF confidence (0.61); Long text (153 words); Complex text (readability: -113.8),153,1085,1,7.091503267973856,en,-113.78941176470585,0.39869281045751637,0.0,0.0,0.0,0.0,0,0,0.0,0.6091766562195717,Access,True,0.010606,0.6091264486312866,Access,True,0.133704
new starter georgian access card enabling bucharest tuesday hello va ne date administration officer,1,Complex text (readability: 11.3); Rich vocabulary (1.00),14,99,1,7.071428571428571,en,11.339285714285722,1.0,0.0,0.0,0.0,0.0,0,0,0.0,0.9802689157696554,HR Support,True,0.010101,0.997765302658081,HR Support,True,0.043684
new project code oracle fusion please create code hello please create code per attached form best regards,1,Rich vocabulary (0.76),17,105,1,6.176470588235294,en,60.19176470588238,0.7647058823529411,0.0,0.0,0.0,0.0,0,0,0.0,0.991873917831224,Internal Project,True,0.01036,0.9972577691078186,Internal Project,True,0.0328
new starter october starter form hello please fill enclosed thanks,1,Rich vocabulary (0.90),10,66,1,6.6,en,61.32500000000002,0.9,0.0,0.0,0.0,0.0,0,0,0.0,0.9896042226367946,HR Support,True,0.010141,0.998706579208374,HR Support,True,0.03907
new purchase po one friday july pm purchase po dear purchased link link please log allocation please take consideration mandatory receipts section order receive item ordered how video please explorer kind regards administrator,1,Complex text (readability: 9.3); Rich vocabulary (0.85),33,226,1,6.848484848484849,en,9.26727272727274,0.8484848484848485,0.0,0.0,0.0,0.0,0,0,0.0,0.9812977673113196,Purchase,True,0.00802,0.9985454082489014,Purchase,True,0.108041
access to confluence tuesday july pm confluence hi confluence think user confluence prod users tx,1,Complex text (readability: 28.1); Rich vocabulary (0.80),15,97,1,6.466666666666667,en,28.05000000000001,0.8,0.0,0.0,0.0,0.0,0,0,0.0,0.9984280475340496,Access,True,0.010346,0.9990314245223999,Access,True,0.041472
confluence space tuesday pm confluence hello please create confluence visible anyone unit please also make more details please let thanks head analysis,1,Complex text (readability: 23.0); Rich vocabulary (0.82),22,151,1,6.863636363636363,en,22.995909090909095,0.8181818181818182,0.0,0.0,0.0,0.0,0,0,0.0,0.9869828934797725,Access,True,0.010306,0.9990725517272949,Access,True,0.054392
save oracle error save error hello get attached error when try save submit for last week december could you please investigate or advise issue thank you,1,Rich vocabulary (0.81),26,152,1,5.846153846153846,en,47.037307692307735,0.8076923076923077,0.0,0.0,0.0,0.0,0,0,0.0,0.9904284051328576,HR Support,True,0.010232,0.9987409710884094,HR Support,True,0.049718
request to create a new set of users for project create users hi please log tickets requests bellow thank much best wishes engineer thursday pm create users hi please create by users user rights comments record issues cannot other issues logged by other users record issues cannot other issues logged by other users record issues cannot other issues logged by other users record issues cannot other issues logged by other users record issues cannot other issues logged by other users issues logged by questions please let regards head testing hi please create by users user rights comments record issues cannot other issues logged by other users record issues cannot other issues logged by other users record issues cannot other issues logged by other users record issues cannot other issues logged by other users issues logged by questions please let regards head testing hi please create by users user rights comments record issues cannot other issues logged by other users record issues cannot other issues logged by other users record issues cannot other issues logged by other users record issues cannot other issues logged by other users record issues cannot other issues logged by other users record issues cannot other issues logged by other users issues logged by questions please let regards head testing,1,Long text (213 words); Complex text (readability: -151.6),213,1314,1,6.169014084507042,en,-151.55154929577463,0.17370892018779344,0.0,0.0,0.0,0.0,0,0,0.0,0.9352371650352781,Access,True,0.010914,0.9913049936294556,Access,True,0.101479
visual studio license expired sent tuesday vs license expired hello visual studio license expired need be renewed order work current thank you developer en sent tuesday re visual studio license expired hello please be informed visual studio subscription assigned you activate subscription please create personal with same name your work address activate visual studio tool please go settings sign with your personal please kindly let know if further assistance needed best regards analyst,1,Complex text (readability: -26.0),73,488,1,6.684931506849315,en,-26.029863013698616,0.6164383561643836,0.0,0.0,0.0,0.0,0,0,0.0,0.9776303473410213,Access,True,0.010457,0.9989006519317627,Access,True,0.078465
investigation of report difference pm imports finished hello please log tickets imports investigation report difference kind regards application developer pm re imports finished hello currently investigate by difference reports by imports comeback updates kind regards application developer re imports finished thanks generally looks few exceptions please advise took extracts regarding days issue highlighted friday regarding submitted by employees observation these report compare report utilization posted by these guys seems consistent periods think regards imports finished imports kind regards application developer,1,Low TF-IDF confidence (0.51); Complex text (readability: -60.5),80,621,1,7.7625,en,-60.484999999999985,0.5875,0.0,0.0,0.0,0.0,0,0,0.0,0.5060953439096596,Hardware,True,0.017929,0.6954922676086426,Hardware,True,0.10805
am academy wednesday pm re academy hi thank sorry late tuesday december academy hello apologize getting back late order make understand please bellow shared mailbox added additional mailbox under personal mailbox come separate mailbox users added clients which come personal mailbox users owners kindly let which two also note lists accessed inside by default please also let allow members mails looking forward hearing thank best regards analyst ext hub thursday december pm academy hi please create academy mailing contain engineering anyone subscribe possible thank head,1,Complex text (readability: -43.7); Rich vocabulary (0.73),85,573,1,6.741176470588235,en,-43.663529411764685,0.7294117647058823,0.0,0.0,0.0,0.0,0,0,0.0,0.8602712075787107,Storage,True,0.008003,0.9910010695457458,Storage,True,0.091765
second monitor turns black video signal is lost few days ago changed desktop with laptop had desktop monitors one them remained second screen for laptop but seems work fine while working second monitor turns black turn off also message displayed for few seconds if video signal lost monitor connected laptop via cable,1,Complex text (readability: 15.8); Rich vocabulary (0.73),52,317,1,6.096153846153846,en,15.766538461538488,0.7307692307692307,0.0,0.0,0.0,0.0,0,0,0.0,0.9918217820555162,Hardware,True,0.007807,0.9979208111763,Hardware,True,0.062738
replace cable replace cable hello please open ticket assign she noticed issues with image quality her monitor after replacing cable image quality returned normal thank you engineer ext en,1,Complex text (readability: 17.0); Rich vocabulary (0.83),29,187,1,6.448275862068965,en,16.951724137931052,0.8275862068965517,0.0,0.0,0.0,0.0,0,0,0.0,0.9461863739504975,Hardware,True,0.007958,0.9972299933433533,Hardware,True,0.049841
oracle error sent wednesday error pot status error sa print screen manager en,1,Unsupported language (nl); Rich vocabulary (0.85),13,77,1,5.923076923076923,nl,50.470769230769264,0.8461538461538461,0.0,0.0,0.0,0.0,0,0,0.0,0.9608161511248954,HR Support,True,0.007883,0.9983307719230652,HR Support,True,0.039003
connection issues with servers sent tuesday february connection issues with servers dear trying connect following servers but with success server works fine located could you have look if you please other colleagues also encounter problem thanks engineer,1,Complex text (readability: 18.4); Rich vocabulary (0.81),37,254,1,6.864864864864865,en,18.37189189189189,0.8108108108108109,0.0,0.0,0.0,0.0,0,0,0.0,0.9659876046406994,Hardware,True,0.016615,0.9947276711463928,Hardware,True,0.05508
critical alert sent saturday july critical alert following alert occurred status active description tape failed recovery hardware cannot be completed could find valid recovery point disk,1,Low TF-IDF confidence (0.45); Complex text (readability: 11.2); Rich vocabulary (0.85),26,186,1,7.153846153846154,en,11.245000000000033,0.8461538461538461,0.0,0.0,0.0,0.0,0,0,0.0,0.451751082861812,Hardware,True,0.007775,0.9409571886062622,Hardware,True,0.042827
oracle approvals sent monday approvals hi currently assigned line manager but unable submitted for approval have confirmation seen them being sent her for approval can you please investigate let know if additional details needed note attached screen capture latest actions required none relating th week need approve best regards senior tester master,1,Complex text (readability: -5.4); Rich vocabulary (0.92),52,350,1,6.730769230769231,en,-5.383461538461518,0.9230769230769231,0.0,0.0,0.0,0.0,0,0,0.0,0.9706196797265207,Miscellaneous,True,0.007824,0.9979154467582703,Miscellaneous,True,0.071272
hr upgrade sent thursday july upgrade hello could you please open ticket upgrade tool version best regards engineer managed en information confidential be legally privileged intended solely for addressee any opinions expressed mine necessarily represent opinions,1,Complex text (readability: -6.0); Rich vocabulary (0.92),36,262,1,7.277777777777778,en,-5.954999999999984,0.9166666666666666,0.0,0.0,0.0,0.0,0,0,0.0,0.8752002713208322,Administrative rights,True,0.007542,0.9925071597099304,Administrative rights,True,0.068183
downtime notification form tuesday march pm downtime form hi please communication per form possible please communication per schedule today thursday hrs thanks kind regards officer,1,Low TF-IDF confidence (0.63); Complex text (readability: 15.6); Rich vocabulary (0.76),25,180,1,7.2,en,15.644000000000034,0.76,0.0,0.0,0.0,0.0,0,0,0.0,0.6324246155127067,Hardware,True,0.007878,0.9875670671463013,Hardware,True,0.050786
to project tudor hi please mirroring resources thank application discipline lead,1,Low TF-IDF confidence (0.56); Complex text (readability: 26.5); Rich vocabulary (1.00); Transformer more confident (0.69 vs 0.56),11,80,1,7.2727272727272725,en,26.470000000000027,1.0,0.0,0.0,0.0,0.0,0,0,0.0,0.5633545251115352,Internal Project,True,0.009236,0.6948468685150146,HR Support,True,0.089601
leavers service now please close accounts tower,1,Rich vocabulary (1.00),7,47,1,6.714285714285714,en,78.87285714285717,1.0,0.0,0.0,0.0,0.0,0,0,0.0,0.7730014017392446,HR Support,True,0.007931,0.9862132668495178,HR Support,True,0.032697
for on mobile possible tuesday pm mobile possible hi possible mobile phone available app enable join calls via phone re thank program,1,Rich vocabulary (0.77),22,133,1,6.045454545454546,fr,30.686818181818182,0.7727272727272727,0.0,0.0,0.0,0.0,0,0,0.0,0.9912672509876993,Hardware,True,0.010162,0.9984093308448792,Hardware,True,0.043102
owner pm owner hello ask responsible section thanks kind regards mobility officer,1,Complex text (readability: 11.4); Rich vocabulary (0.92),12,81,1,6.75,en,11.355000000000018,0.9166666666666666,0.0,0.0,0.0,0.0,0,0,0.0,0.8936039751910331,Miscellaneous,True,0.010239,0.9972781538963318,Miscellaneous,True,0.040654
hosting code hosting code hi regarding source control hosting how much take repository cost how much thanks regards,1,Low TF-IDF confidence (0.60); Rich vocabulary (0.72),18,115,1,6.388888888888889,en,52.265000000000015,0.7222222222222222,0.0,0.0,0.0,0.0,0,0,0.0,0.5973443487940128,Access,True,0.009513,0.8150465488433838,Access,True,0.039603
oracle sent tuesday october hi sent be approved by today when she tried access them were blank could you please check what wrong thank you communication specialist,1,Low TF-IDF confidence (0.51); Rich vocabulary (0.93); Transformer more confident (0.62 vs 0.51),27,163,1,6.037037037037037,en,50.96333333333334,0.9259259259259259,0.0,0.0,0.0,0.0,0,0,0.0,0.5055545887326666,Hardware,True,0.00998,0.618109941482544,HR Support,True,0.050249
new starter date hello please fill starter form hopefully he his activity st thanks,1,Rich vocabulary (0.93),14,83,1,5.928571428571429,en,59.68214285714288,0.9285714285714286,0.0,0.0,0.0,0.0,0,0,0.0,0.9870074798085234,HR Support,True,0.016222,0.9987866282463074,HR Support,True,0.108434
opportunity pending approval tuesday pm opportunity pending hi please opportunity pending fully approved thank best regards programme portfolio officer,1,Complex text (readability: -21.7); Rich vocabulary (0.79),19,151,1,7.947368421052632,en,-21.7236842105263,0.7894736842105263,0.0,0.0,0.0,0.0,0,0,0.0,0.9575401572499738,Miscellaneous,True,0.010388,0.9978571534156799,Miscellaneous,True,0.045942
please check tv from meeting room tuesday pm please tv meeting room dear sir madam kindly tv room subject checked thank phone,1,Rich vocabulary (0.73),22,125,1,5.681818181818182,en,61.45045454545455,0.7272727272727273,0.0,0.0,0.0,0.0,0,0,0.0,0.9900970089568742,Hardware,True,0.008456,0.9984539747238159,Hardware,True,0.047741
access to confluence pm hello dears please view confluence referenced thank,1,Rich vocabulary (0.91),11,75,1,6.818181818181818,en,41.8518181818182,0.9090909090909091,0.0,0.0,0.0,0.0,0,0,0.0,0.9926021890239516,Access,True,0.007646,0.9989001750946045,Access,True,0.041067
faulty notifications flow requested item warning for faulty flow requested item warning hello kindly amend reach thanks leader mobile wednesday december pm requested item warning close breaching please advised close breaching reference number summary script extract site files priority resolution target date assigned engineer please,1,Complex text (readability: -9.9); Rich vocabulary (0.76),45,333,1,7.4,en,-9.919999999999959,0.7555555555555555,0.0,0.0,0.0,0.0,0,0,0.0,0.944744597174034,Miscellaneous,True,0.010516,0.9965531826019287,Miscellaneous,True,0.070675
new purchase po wednesday july pm purchase po dear purchased has please log allocation please take consideration mandatory receipts section order receive item ordered how video please explorer kind regards administrator,1,Complex text (readability: 6.2); Rich vocabulary (0.87),31,219,1,7.064516129032258,en,6.170000000000016,0.8709677419354839,0.0,0.0,0.0,0.0,0,0,0.0,0.987227160080532,Purchase,True,0.008071,0.9985916018486023,Purchase,True,0.102066
access to ops wireless network wireless hello please provide wireless allows remote client allow haven needed quite ad radius authentication work thanks head infrastructure,1,Complex text (readability: 20.3); Rich vocabulary (0.92),24,172,1,7.166666666666667,en,20.325000000000017,0.9166666666666666,0.0,0.0,0.0,0.0,0,0,0.0,0.8726522243620373,Hardware,True,0.008173,0.8967243432998657,Hardware,True,0.038011
wants to access resources write access friday march pm wants resources please write file justification update file thanks accept decline,1,Rich vocabulary (0.75),20,136,1,6.8,en,38.48500000000004,0.75,0.0,0.0,0.0,0.0,0,0,0.0,0.9652169786035163,Storage,True,0.008149,0.9970732927322388,Storage,True,0.040512
please provide access to wednesday february pm please provide hi please give thank,1,Rich vocabulary (0.77),13,82,1,6.3076923076923075,en,56.97846153846157,0.7692307692307693,0.0,0.0,0.0,0.0,0,0,0.0,0.963403419664932,HR Support,True,0.007957,0.9984999895095825,HR Support,True,0.033982
connection issues on the network with the assigned and address connection issues with assigned address hi facing connection issues number en tried changing cable switch with working ones works for colleagues machine still luck problem must be with address if change works can you please assist further thank you,1,Complex text (readability: 29.3); Rich vocabulary (0.73),49,311,1,6.346938775510204,en,29.336734693877588,0.7346938775510204,0.0,0.0,0.0,0.0,0,0,0.0,0.9519177904897695,Hardware,True,0.007968,0.9977834820747375,Hardware,True,0.049087
